title,content,source,publishedAt,url,Overall Sentiment,Positive Sentiment,Neutral Sentiment,Negative Sentiment
Stock market news live updates: Stock futures extend gains after Fed expands bond-buying program - yahoo.com,"Stock futures kicked off the overnight session higher Monday evening, extending gains from the regular trading day.
Earlier, stocks closed out a choppy session higher, with equities in the morning t… [+2717 chars]","{'id': None, 'name': 'Yahoo Entertainment'}",2020-06-15 22:22:00,https://finance.yahoo.com/news/stock-market-news-live-june-16-2020-222206832.html,0,0.39,0.61,0.0
A Beginner’s Guide to Employee Stock Plans,"So youve started a new job and the company offers stock options as part of its benefits package. Maybe you have no idea what that means, or youre not quite sure how to get started. Here are some basi… [+9427 chars]","{'id': None, 'name': 'Lifehacker.com'}",2020-06-16 17:14:00,https://twocents.lifehacker.com/a-beginner-s-guide-to-your-company-s-employee-stock-pla-1720502775,0,0.04,0.92,0.04
Want an Oculus Quest? Inventory is limited -- but in stock now - CNET,"Sarah Tew/CNET
The Oculus Quest, the runaway hit VR headset that's been largely unavailable from any retailer since the holidays, is finally coming back in stock. That's great news for VR fans. The … [+3113 chars]","{'id': None, 'name': 'CNET'}",2020-06-17 21:48:00,https://www.cnet.com/news/almost-impossible-to-get-oculus-quest-back-in-stock-at-amazon-oculus/,0,0.01,0.97,0.02
All bets are off as Hertz pulls plan to issue $500 million in new stock,"Hertz, which filed for bankruptcy last month, halted its $500 million stock offering Wednesday after the U.S. Securities and Exchange Commission told the rental company it would review its controvers… [+2345 chars]","{'id': 'techcrunch', 'name': 'TechCrunch'}",2020-06-17 23:03:28,http://techcrunch.com/2020/06/17/all-bets-are-off-as-hertz-pulls-plan-to-issue-500-million-in-new-stock/,0,0.03,0.6,0.37
This limited-edition 'The Last of Us Part II' game drive is *finally* back in stock,"TL;DR: Seagate's limited-edition The Last of Us Part II game drive for PS4 is finally back in stock at Best Buy as of June 18, and it comes with your choice of two gifts from Shutterfly.
After seven… [+1792 chars]","{'id': 'mashable', 'name': 'Mashable'}",2020-06-18 15:38:22,https://mashable.com/shopping/june-18-seagate-last-of-us-part-ii-game-drive-ps4-best-buy/,0,0.02,0.89,0.09
Do you think Samsung software is better than 'stock' Android?,"06-19-2020 05:31 PM
This right here.
Like Samsung's features or not, you have to admit they make their own stuff and don't depend nearly so much on Google. That it's Google under the skin is gettin… [+224 chars]","{'id': None, 'name': 'Android Central'}",2020-06-22 12:39:16,https://www.androidcentral.com/do-you-think-samsung-software-better-stock-android,1,0.99,0.01,0.0
iPadOS 14 focuses on giving apps a macOS feel,"Apple showcased a few new tablet-specific updates coming to iPadOS that aim to appease users hungry for software that treats the devices as laptop replacements.
Apple’s iPad-specific updates are fai… [+1609 chars]","{'id': 'techcrunch', 'name': 'TechCrunch'}",2020-06-22 18:12:54,http://techcrunch.com/2020/06/22/ipados-14-focuses-on-giving-apps-a-macos-feel/,0,0.0,1.0,0.0
Here’s how Apple’s stock fared during the WWDC keynote,"Apple held its WWDC keynote today, a virtual affair that managed to convince swaths of the technology industry to watch a pre-recorded video.
While TechCrunch has posts galore up on the site about a… [+3790 chars]","{'id': 'techcrunch', 'name': 'TechCrunch'}",2020-06-22 19:27:36,http://techcrunch.com/2020/06/22/heres-how-apples-stock-fared-during-the-wwdc-keynote/,0,0.01,0.98,0.01
NYSE seeks SEC approval for more direct listings,"The New York Stock Exchange filed an amendment today with the Securities and Exchange Commission to allow for more direct listings.
Direct listings offer a more streamlined method for companies to g… [+2106 chars]","{'id': 'techcrunch', 'name': 'TechCrunch'}",2020-06-22 20:38:42,http://techcrunch.com/2020/06/22/nyse-seeks-sec-approval-for-more-direct-listings/,0,0.01,0.98,0.01
BRIEF-Huiyin Holdings Group Updates On Decision Of Stock Exchange - Reuters,"June 23 (Reuters) - Huiyin Holdings Group Ltd: 
* HUIYIN HOLDINGS GROUP UPDATES ON DECISION OF STOCK EXCHANGE THAT CO FAILED TO COMPLY WITH A LISTING RULE 
* GOT A LETTER FROM LISTING COMMITTEE ON … [+369 chars]","{'id': 'reuters', 'name': 'Reuters'}",2020-06-23 15:11:00,https://www.reuters.com/article/brief-huiyin-holdings-group-updates-on-d-idUSFWN2E00Q1,0,0.0,1.0,0.0
BRIEF-Soleno Therapeutics Announces Proposed Public Offering Of Common Stock - Reuters,"June 23 (Reuters) - Soleno Therapeutics Inc: 
* SOLENO THERAPEUTICS ANNOUNCES PROPOSED PUBLIC OFFERING OF COMMON STOCK Source text for Eikon: Further company coverage:","{'id': 'reuters', 'name': 'Reuters'}",2020-06-23 20:47:00,https://www.reuters.com/article/brief-soleno-therapeutics-announces-prop-idUSASA00UP5,0,0.0,0.99,0.01
BRIEF-Tela Bio Files To Offer $3 Mln Shares Of Common Stock - Reuters,"June 23 (Reuters) - TELA Bio Inc: 
* TELA BIO FILES TO OFFER $3 MILLION SHARES OF COMMON STOCK - SEC FILING Source text: [bit.ly/2Z0wwqd] Further company coverage: (Reuters.Briefs@thomsonreuters.com)","{'id': 'reuters', 'name': 'Reuters'}",2020-06-23 21:01:00,https://www.reuters.com/article/brief-tela-bio-files-to-offer-3-mln-shar-idUSFWN2E00T6,0,0.0,0.99,0.01
BRIEF-Outlook Therapeutics Files Prospectus Supplement Related To Offering Of 8.4 Mln Shares Of Common Stock - SEC Filing - Reuters,"June 23 (Reuters) - Outlook Therapeutics Inc: 
* OUTLOOK THERAPEUTICS INC FILES PROSPECTUS SUPPLEMENT RELATED TO OFFERING OF 8.4 MILLION SHARES OF COMMON STOCK - SEC FILING Source text: bit.ly/2zWiL… [+27 chars]","{'id': 'reuters', 'name': 'Reuters'}",2020-06-23 21:21:00,https://www.reuters.com/article/brief-outlook-therapeutics-files-prospec-idUSFWN2E00TD,0,0.0,1.0,0.0
BRIEF-Editas Medicine Files Preliminary Prospectus Related To Offering Of 4 Mln Shares Of Common Stock - SEC Filing - Reuters,"June 23 (Reuters) - Editas Medicine Inc: 
* EDITAS MEDICINE INC FILES PRELIMINARY PROSPECTUS RELATED TO OFFERING OF 4 MILLION SHARES OF COMMON STOCK - SEC FILING Source text: bit.ly/2Z5yoxQ Further … [+16 chars]","{'id': 'reuters', 'name': 'Reuters'}",2020-06-23 23:27:00,https://www.reuters.com/article/brief-editas-medicine-files-preliminary-idUSFWN2E00T9,0,0.0,1.0,0.0
BRIEF-Editas Medicine Files Preliminary Prospectus Related To Offering Of 4 Mln Shares Of Common Stock - SEC Filing - Reuters,"June 23 (Reuters) - Editas Medicine Inc: 
* EDITAS MEDICINE INC FILES PRELIMINARY PROSPECTUS RELATED TO OFFERING OF 4 MILLION SHARES OF COMMON STOCK - SEC FILING Source text: bit.ly/2Z5yoxQ Further … [+16 chars]","{'id': 'reuters', 'name': 'Reuters'}",2020-06-23 23:27:00,https://uk.reuters.com/article/brief-editas-medicine-files-preliminary-idUKFWN2E00T9,0,0.0,1.0,0.0
BRIEF-Palomar Holdings Announces Pricing Of Public Offering Of Common Stock - Reuters,"June 23 (Reuters) - Palomar Holdings Inc: 
* PALOMAR HOLDINGS, INC. ANNOUNCES PRICING OF PUBLIC OFFERING OF COMMON STOCK 
* SAYS OFFERING OF 1.00 MILLION SHARES PRICED AT $82.00PER SHARE Source tex… [+37 chars]","{'id': 'reuters', 'name': 'Reuters'}",2020-06-24 00:32:00,https://www.reuters.com/article/brief-palomar-holdings-announces-pricing-idUSASA00UQI,0,0.0,0.99,0.01
BRIEF-Editas Medicine Announces Pricing Of Offering Of Common Stock - Reuters,"June 23 (Reuters) - Editas Medicine Inc: 
* EDITAS MEDICINE ANNOUNCES PRICING OF OFFERING OF COMMON STOCK 
* ANNOUNCED PRICING OF UNDERWRITTEN OFFERING OF 6 MILLION SHARES OF ITS STOCK AT PUBLIC OF… [+80 chars]","{'id': 'reuters', 'name': 'Reuters'}",2020-06-24 01:52:00,https://www.reuters.com/article/brief-editas-medicine-announces-pricing-idUSASA00UQL,0,0.0,1.0,0.0
BRIEF-Editas Medicine Announces Pricing Of Offering Of Common Stock - Reuters India,"June 23 (Reuters) - Editas Medicine Inc: 
* EDITAS MEDICINE ANNOUNCES PRICING OF OFFERING OF COMMON STOCK 
* ANNOUNCED PRICING OF UNDERWRITTEN OFFERING OF 6 MILLION SHARES OF ITS STOCK AT PUBLIC OF… [+80 chars]","{'id': 'reuters', 'name': 'Reuters'}",2020-06-24 01:53:00,https://in.reuters.com/article/brief-editas-medicine-announces-pricing-idINASA00UQL,0,0.0,1.0,0.0
BRIEF-Nantkwest Announces Proposed Public Offering Of Common Stock - Reuters,"June 24 (Reuters) - NantKwest Inc: 
* NANTKWEST ANNOUNCES PROPOSED PUBLIC OFFERING OF COMMON STOCK Source text for Eikon: Further company coverage:","{'id': 'reuters', 'name': 'Reuters'}",2020-06-24 20:18:00,https://www.reuters.com/article/brief-nantkwest-announces-proposed-publi-idUSASA00UU8,0,0.0,0.99,0.01
BRIEF-Translate Bio Announces Proposed Public Offering Of Common Stock - Reuters,"June 24 (Reuters) - Translate Bio Inc: 
* TRANSLATE BIO ANNOUNCES PROPOSED PUBLIC OFFERING OF COMMON STOCK 
* TRANSLATE BIO - COMMENCED UNDERWRITTEN PUBLIC OFFERING OF $125.0 MILLION OF COMMON STOC… [+233 chars]","{'id': 'reuters', 'name': 'Reuters'}",2020-06-24 20:43:00,https://www.reuters.com/article/brief-translate-bio-announces-proposed-p-idUSASA00UUD,0,0.01,0.98,0.01
BRIEF-Castle Biosciences Announces Pricing Of $74 Mln Public Offering Of Stock - Reuters,"June 24 (Reuters) - Castle Biosciences Inc: 
* CASTLE BIOSCIENCES ANNOUNCES PRICING OF $74.0 MILLION PUBLIC OFFERING OF COMMON STOCK 
* PRICING OF ITS UNDERWRITTEN PUBLIC OFFERING OF 2 MILLION SHAR… [+111 chars]","{'id': 'reuters', 'name': 'Reuters'}",2020-06-25 02:38:00,https://www.reuters.com/article/brief-castle-biosciences-announces-prici-idUSASA00UVC,0,0.0,1.0,0.0
BRIEF-London Stock Exchange appoints Anna Manz as CFO - Reuters UK,"June 25 (Reuters) - London Stock Exchange Group PLC: 
* LONDONSTOCKEXGROUP - DIRECTORATE CHANGE 
* LSEG APPOINTS ANNA MANZ AS CHIEF FINANCIAL OFFICER 
* SHE SUCCEEDS DAVID WARREN WHO ANNOUNCED IN … [+388 chars]","{'id': 'reuters', 'name': 'Reuters'}",2020-06-25 06:04:00,https://uk.reuters.com/article/brief-london-stock-exchange-appoints-ann-idUKASN0008I7,0,0.0,0.99,0.01
London Stock Exchange appoints Manz as CFO - Reuters,"LONDON, June 25 (Reuters) - The London Stock Exchange on Thursday said it had appointed Anna Manz as chief financial officer from November, when the exchange hopes it will have obtained approval for … [+1104 chars]","{'id': 'reuters', 'name': 'Reuters'}",2020-06-25 06:41:00,https://www.reuters.com/article/lse-cfo-idUSL8N2E211M,0,0.0,0.99,0.01
London Stock Exchange appoints Manz as CFO - Reuters UK,"LONDON (Reuters) - The London Stock Exchange on Thursday said it had appointed Anna Manz as chief financial officer from November, when the exchange hopes it will have obtained approval for its $27 b… [+1113 chars]","{'id': 'reuters', 'name': 'Reuters'}",2020-06-25 06:45:00,https://uk.reuters.com/article/uk-lse-cfo-idUKKBN23W0T6,0,0.0,0.99,0.01
Lufthansa stock soars as billionaire OKs bailout - Reuters,"Posted 
Billionaire investor Heinz Hermann Thiele says he won't veto a state bailout for Lufthansa, sending the airline's stock soaring in early trade Thursday.","{'id': 'reuters', 'name': 'Reuters'}",2020-06-25 10:31:31,https://www.reuters.com/video/watch/idP$61?now=true,0,0.01,0.98,0.01
TSX futures drop on weaker oil prices - Reuters Canada,"(Reuters) - Canada’s main stock index futures fell on Thursday, dragged by weaker oil prices, as record-high U.S. crude stock and an upsurge in global COVID-19 cases dented hopes of recovery in fuel … [+679 chars]","{'id': 'reuters', 'name': 'Reuters'}",2020-06-25 11:35:00,https://ca.reuters.com/article/topNews/idCAKBN23W1QT,-1,0.0,0.02,0.98
BRIEF-Stock Exchange Of Thailand & Thailand Futures Exchange To Prolong Recent Trading Rule Amendments Until Sept - Reuters,"June 25 (Reuters) - Stock Exchange of Thailand: 
* STOCK EXCHANGE OF THAILAND &amp; THAILAND FUTURES EXCHANGE TO PROLONG ITS RECENT TRADING RULE AMENDMENTS UNTIL SEPT 
* THAILAND FUTURES EXCHANGE D… [+250 chars]","{'id': 'reuters', 'name': 'Reuters'}",2020-06-25 12:54:00,https://www.reuters.com/article/brief-stock-exchange-of-thailand-thailan-idUSFWN2E20P6,0,0.01,0.99,0.0
Private equity firm Great Hill Partners acquires stock media service Storyblocks,"Storyblocks, the subscription-based stock media service, today announced that it has been acquired by private equity firm Great Hill Partners. The firm previously backed companies like Wayfair (and t… [+3708 chars]","{'id': 'techcrunch', 'name': 'TechCrunch'}",2020-06-25 13:00:09,http://techcrunch.com/2020/06/25/private-equity-firm-great-hill-partners-acquires-stock-media-service-storyblocks/,1,0.98,0.02,0.0
BRIEF-Soliton Announces Proposed Public Offering Of Common Stock - Reuters,"June 25 (Reuters) - Soliton Inc: 
* SOLITON ANNOUNCES PROPOSED PUBLIC OFFERING OF COMMON STOCK 
* SOLITON INC - INTENDS TO OFFER SHARES OF COMMON STOCK IN AN UNDERWRITTEN PUBLIC OFFERING Source tex… [+37 chars]","{'id': 'reuters', 'name': 'Reuters'}",2020-06-25 20:47:00,https://www.reuters.com/article/brief-soliton-announces-proposed-public-idUSASA00UZ3,0,0.0,0.99,0.01
BRIEF-Tela Bio Announces Pricing Of Public Offering Of Common Stock - Reuters,"June 25 (Reuters) - TELA Bio Inc: 
* TELA BIO ANNOUNCES PRICING OF PUBLIC OFFERING OF COMMON STOCK 
* SAYS PUBLIC OFFERING OF 3.00 MILLION COMMON SHARES PRICED AT $16.00PER SHARE Source text for Ei… [+29 chars]","{'id': 'reuters', 'name': 'Reuters'}",2020-06-25 23:27:00,https://uk.reuters.com/article/brief-tela-bio-announces-pricing-of-publ-idUKASA00V0F,0,0.0,0.99,0.01
BRIEF-Tela Bio Announces Pricing Of Public Offering Of Common Stock - Reuters India,"June 25 (Reuters) - TELA Bio Inc: 
* TELA BIO ANNOUNCES PRICING OF PUBLIC OFFERING OF COMMON STOCK 
* SAYS PUBLIC OFFERING OF 3.00 MILLION COMMON SHARES PRICED AT $16.00PER SHARE Source text for Ei… [+29 chars]","{'id': 'reuters', 'name': 'Reuters'}",2020-06-25 23:28:00,https://in.reuters.com/article/brief-tela-bio-announces-pricing-of-publ-idINASA00V0F,0,0.0,0.99,0.01
BRIEF-Translate Bio Announces Pricing Of Public Offering Of Common Stock - Reuters,"June 25 (Reuters) - Translate Bio Inc: 
* TRANSLATE BIO ANNOUNCES PRICING OF PUBLIC OFFERING OF COMMON STOCK 
* TRANSLATE BIO INC - PRICING OF ITS UNDERWRITTEN PUBLIC OFFERING OF 12,506,811 COMMON … [+101 chars]","{'id': 'reuters', 'name': 'Reuters'}",2020-06-26 01:42:00,https://www.reuters.com/article/brief-translate-bio-announces-pricing-of-idUSASA00V0S,0,0.0,0.99,0.01
Aston Martin turns to stock offering to boost capital - Reuters,June 26 (Reuters) - Aston Martin said on Friday it would issue new shares worth up to 20% of its existing equity capital as the luxury carmaker seeks additional funds to ride out the coronavirus cris… [+284 chars],"{'id': 'reuters', 'name': 'Reuters'}",2020-06-26 06:37:00,https://www.reuters.com/article/aston-martin-issue-idUSL4N2E317W,1,0.63,0.37,0.0
UPDATE 1-Aston Martin turns to stock offering to bolster capital - Reuters India,"(Adds details from statement, background) 
June 26 (Reuters) - Aston Martin said on Friday it would issue new shares worth up to 20% of its existing equity capital as the luxury carmaker seeks addit… [+1583 chars]","{'id': 'reuters', 'name': 'Reuters'}",2020-06-26 07:18:00,https://in.reuters.com/article/aston-martin-issue-idINL4N2E319U,0,0.04,0.96,0.0
Aston Martin turns to stock offering to bolster capital - Reuters,(Reuters) - Aston Martin (AML.L) said on Friday it would issue new shares worth up to 20% of its existing equity capital as the luxury carmaker seeks additional funds to ride out the coronavirus cris… [+1518 chars],"{'id': 'reuters', 'name': 'Reuters'}",2020-06-26 07:27:00,https://www.reuters.com/article/us-aston-martin-issue-idUSKBN23X0XZ,0,0.18,0.82,0.0
BRIEF-Contango Oil Files For Offering Up To 6.2 Mln Shares Of Common Stock By Selling Stockholders - Reuters,"June 26 (Reuters) - Contango Oil &amp; Gas Co (Texas): 
* CONTANGO OIL &amp; GAS CO (TEXAS) FILES FOR OFFERING UP TO 6.2 MILLION SHARES OF COMMON STOCK BY THE SELLING STOCKHOLDERS - SEC FILING Sourc… [+48 chars]","{'id': 'reuters', 'name': 'Reuters'}",2020-06-26 10:28:00,https://www.reuters.com/article/brief-contango-oil-files-for-offering-up-idUSFWN2E215I,0,0.0,1.0,0.0
"As the bike shortage endures, Dick's Sporting Goods has some on sale","TL;DR:Bikes are still on sale at Dick's Sporting Goods  save up to $70 on men's, women's, and children's bikes from Schwinn, Nishiki, and GT.
Toilet paper and hand sanitizer weren't the only things … [+732 chars]","{'id': 'mashable', 'name': 'Mashable'}",2020-06-26 15:05:47,https://mashable.com/shopping/june-26-bikes-in-stock-on-sale/,-1,0.0,0.0,1.0
Dow slides more than 500 points as the economic outlook gets drearier,,"{'id': 'cnn', 'name': 'CNN'}",2020-06-26 15:09:15,https://www.cnn.com/2020/06/26/investing/dow-stock-market-today/index.html,0,0.06,0.8,0.14
Gap will sell Kanye West's Yeezy line. The news sent its stock soaring,,"{'id': 'cnn', 'name': 'CNN'}",2020-06-26 17:48:58,https://www.cnn.com/2020/06/26/investing/yeezy-gap-kanye-west/index.html,0,0.1,0.72,0.18
"Zimbabwe suspends stock exchange, mobile payments over 'economic sabotage' - Reuters","HARARE, June 26 (Reuters) - Zimbabwe on Friday suspended trade on the stock exchange and mobile phone-based payments to address what President Emmerson Mnangagwa’s government called “criminality and … [+1427 chars]","{'id': 'reuters', 'name': 'Reuters'}",2020-06-26 19:17:00,https://www.reuters.com/article/zimbabwe-economy-idUSL8N2E35B1,0,0.0,0.51,0.49
BRIEF-Precipio Inc Files For Potential Sale Of 4.5 Mln Shares Of Common Stock By Selling Stockholders - Reuters,"June 26 (Reuters) - Precipio Inc: 
* PRECIPIO INC FILES FOR POTENTIAL SALE OF 4.5 MILLION SHARES OF COMMON STOCK BY SELLING STOCKHOLDERS - SEC FILING Source text: [bit.ly/2Vp82pA] Further company co… [+42 chars]","{'id': 'reuters', 'name': 'Reuters'}",2020-06-26 22:24:00,https://uk.reuters.com/article/brief-precipio-inc-files-for-potential-s-idUKFWN2E30L9,0,0.0,0.99,0.01
BRIEF-Larimar Therapeutics Inc Files For Stock Shelf Of Upto $170.9 Mln By Selling Stockholders - Reuters,"June 26 (Reuters) - Larimar Therapeutics Inc: 
* LARIMAR THERAPEUTICS INC FILES FOR STOCK SHELF OF UPTO $170.9 MILLION BY SELLING STOCKHOLDERS Source text: [bit.ly/386oRuK] Further company coverage:… [+35 chars]","{'id': 'reuters', 'name': 'Reuters'}",2020-06-26 22:34:00,https://uk.reuters.com/article/brief-larimar-therapeutics-inc-files-for-idUKFWN2E30U9,0,0.0,1.0,0.0
BRIEF-Larimar Therapeutics Inc Files For Stock Shelf Of Upto $170.9 Mln By Selling Stockholders - Reuters,"June 26 (Reuters) - Larimar Therapeutics Inc: 
* LARIMAR THERAPEUTICS INC FILES FOR STOCK SHELF OF UPTO $170.9 MILLION BY SELLING STOCKHOLDERS Source text: [bit.ly/386oRuK] Further company coverage:… [+35 chars]","{'id': 'reuters', 'name': 'Reuters'}",2020-06-26 22:34:00,https://www.reuters.com/article/brief-larimar-therapeutics-inc-files-for-idUSFWN2E30U9,0,0.0,1.0,0.0
"Gunmen attack Pakistani stock exchange, four killed - police - Reuters","KARACHI, Pakistan (Reuters) - Gunmen attacked the Pakistani stock exchange building in the city of Karachi on Monday and four assailants were killed, police said. 
The gunmen attacked the building w… [+386 chars]","{'id': 'reuters', 'name': 'Reuters'}",2020-06-29 06:03:00,https://www.reuters.com/article/us-pakistan-attacks-idUSKBN2400IS,-1,0.0,0.0,1.0
Gunmen attack Pakistani stock exchange in Karachi,"Gunmen have attacked the Pakistani stock exchange in the southern city of Karachi, killing at least two people and injuring others, local media report.
The assailants stormed the building after laun… [+514 chars]","{'id': 'bbc-news', 'name': 'BBC News'}",2020-06-29 06:14:44,https://www.bbc.co.uk/news/world-asia-53217227,-1,0.02,0.09,0.89
Brockhaus Capital Management to list on Frankfurt stock exchange - Reuters,"FRANKFURT, June 29 (Reuters) - German private equity investor Brockhaus Capital Management (BCM) is planning to list on the Frankfurt stock exchange in the third quarter, it said on Monday. 
Brockha… [+653 chars]","{'id': 'reuters', 'name': 'Reuters'}",2020-06-29 08:18:00,https://www.reuters.com/article/brockhaus-ipo-idUSASN0008O4,0,0.01,0.98,0.01
Gunmen attack Pakistani stock exchange - Reuters Canada,"Posted 
The gunmen attacked the building, which is in a high security zone that also houses the head offices of many private banks, with grenades and guns, said Ghulam Nabi Memon, chief of police in… [+46 chars]","{'id': 'reuters', 'name': 'Reuters'}",2020-06-29 08:24:36,https://www.reuters.com/video/watch/idOVCKFI05D,-1,0.02,0.14,0.84
Deutsche Boerse to study revising DAX membership rules in wake of Wirecard - Reuters,"FRANKFURT (Reuters) - German stock exchange operator Deutsche Boerse (DB1Gn.DE) said on Monday that it was studying revisions to membership rules for Germany’s premier stock market index, the DAX, in… [+257 chars]","{'id': 'reuters', 'name': 'Reuters'}",2020-06-29 11:58:00,https://www.reuters.com/article/us-deutsche-boerse-dax-idUSKBN2401F0,0,0.02,0.97,0.01
BRIEF-Liquidia Announces Proposed Offering Of Common Stock - Reuters,"June 29 (Reuters) - Liquidia Technologies Inc: 
* LIQUIDIA ANNOUNCES PROPOSED OFFERING OF COMMON STOCK Source text for Eikon: Further company coverage:","{'id': 'reuters', 'name': 'Reuters'}",2020-06-29 21:14:00,https://www.reuters.com/article/brief-liquidia-announces-proposed-offeri-idUSASA00VAL,0,0.0,0.99,0.01
BRIEF-Liquidia Announces Pricing Of Public Offering Of Common Stock - Reuters.com,"June 29 (Reuters) - Liquidia Technologies Inc: 
* LIQUIDIA ANNOUNCES PRICING OF PUBLIC OFFERING OF COMMON STOCK 
* ANNOUNCED PRICING OF UNDERWRITTEN PUBLIC OFFERING OF 9.375 MILLION SHARES OF ITS S… [+93 chars]","{'id': 'reuters', 'name': 'Reuters'}",2020-06-30 02:39:00,https://www.reuters.com/article/brief-liquidia-announces-pricing-of-publ-idUSASA00VC8,0,0.0,0.99,0.01
BRIEF-Healthcare Approves Change In Company's Common Stock Dividend Policy - Reuters,"June 30 (Reuters) - Healthcare Trust Inc: 
* HEALTHCARE TRUST INC - APPROVED A CHANGE IN COMPANY’S COMMON STOCK DIVIDEND POLICY 
* HEALTHCARE TRUST INC - WILL NO LONGER DECLARE DIVIDENDS BASED ON D… [+205 chars]","{'id': 'reuters', 'name': 'Reuters'}",2020-06-30 21:55:00,https://www.reuters.com/article/brief-healthcare-approves-change-in-comp-idUSFWN2E711H,0,0.01,0.98,0.01
BRIEF-Acceleron Announces Pricing Of Public Offering Of Common Stock - Reuters,"June 30 (Reuters) - Acceleron Pharma Inc: 
* ACCELERON ANNOUNCES PRICING OF PUBLIC OFFERING OF COMMON STOCK 
* SAYS PUBLIC OFFERING OF 4.86 MILLION COMMON SHARES PRICED AT $92.50PER SHARE Source te… [+74 chars]","{'id': 'reuters', 'name': 'Reuters'}",2020-07-01 00:10:00,https://www.reuters.com/article/brief-acceleron-announces-pricing-of-pub-idUSASA00VIK,0,0.0,0.99,0.01
BRIEF-Avita Medical Says Co's U.S. Shares Of Common Stock Commenced Trading On Nasdaq Stock Market - Reuters,"July 1 (Reuters) - Avita Medical Ltd: 
* AVITA US’S SHARES OF COMMON STOCK COMMENCED TRADING ON NASDAQ STOCK MARKET LLC Source text nASX7pTdDY Further company coverage:","{'id': 'reuters', 'name': 'Reuters'}",2020-07-01 01:40:00,https://www.reuters.com/article/brief-avita-medical-says-cos-us-shares-o-idUSFWN2E712B,0,0.0,0.98,0.02
"German stock trading platform Xetra down, all securities affected - Reuters","LONDON (Reuters) - Frankfurt-based electronic trading system Xetra was experiencing a “technical issue”, affecting all securities traded on the platform, a Deutsche Boerse spokesman said on Wednesday… [+1026 chars]","{'id': 'reuters', 'name': 'Reuters'}",2020-07-01 08:38:00,https://www.reuters.com/article/us-germany-stocks-xetra-idUSKBN2424YE,0,0.0,0.99,0.01
BRIEF-Adapthealth Corp. Announces Pricing Of Upsized Public Offering Of Class A Common Stock - Reuters UK,"July 1 (Reuters) - Adapthealth Corp: 
* ADAPTHEALTH CORP. ANNOUNCES PRICING OF UPSIZED PUBLIC OFFERING OF CLASS A COMMON STOCK 
* ADAPTHEALTH CORP - PRICED PUBLIC OFFERING OF 8 MILLION SHARES OF CL… [+86 chars]","{'id': 'reuters', 'name': 'Reuters'}",2020-07-01 11:42:00,https://uk.reuters.com/article/brief-adapthealth-corp-announces-pricing-idUKASA00VK1,0,0.0,0.99,0.01
Everything You Need to Watch Netflix in 4K on Your Mac,"Several Mac desktops and laptops have all the hardware they need to stream 4K HDR video from services like Netflix, but theyve been hamstrung by Safaris limited video codec support. Luckily, Apple is… [+1598 chars]","{'id': None, 'name': 'Lifehacker.com'}",2020-07-01 13:00:00,https://lifehacker.com/everything-you-need-to-watch-netflix-in-4k-on-your-mac-1844222310,0,0.35,0.64,0.01
Tesla becomes most valuable automaker in latest stock rally - Reuters,(Reuters) - Tesla Inc on Wednesday became the highest-valued automaker as its shares surged to new record highs and the electric carmaker’s market cap overtook that of former front runner Toyota Moto… [+102 chars],"{'id': 'reuters', 'name': 'Reuters'}",2020-07-01 14:48:00,https://www.reuters.com/article/us-tesla-shares-idUSKBN2426E8,1,0.94,0.06,0.0
Stock surge makes Tesla the world’s most valuable automaker,"0 with 0 posters participating
One share of Tesla stock traded for more than $1,130 on Wednesday, pushing the company's market capitalization to nearly $210 billion. That sent Tesla's market cap pas… [+3646 chars]","{'id': 'ars-technica', 'name': 'Ars Technica'}",2020-07-01 15:37:01,https://arstechnica.com/cars/2020/07/stock-surge-makes-tesla-the-worlds-most-valuable-automaker/,1,0.98,0.02,0.0
